{
  "schema": "tavonel.arena.runtime.v1",
  "model_key": "mineru_vlm",
  "display_name": "MinerU2.5-Pro-2605-1.2B via MinerU vlm-engine (vllm-engine) - complex table/layout specialist",
  "model_repo": "opendatalab/MinerU2.5-Pro-2605-1.2B",
  "model_revision": "bff20d4ae2bf202df9f45284b4d43681555a97ed",
  "runtime_repository": "opendatalab/MinerU",
  "runtime_revision": "fbb1257a555a3fde78ae5aaaa931e3b3f8fb2883",
  "official_runtime": "vllm",
  "runtime_version": "MinerU tag mineru-3.4.5-released @ fbb1257a555a3fde78ae5aaaa931e3b3f8fb2883, backend=vlm-engine resolved to the vllm-engine engine",
  "base_image": "vllm/vllm-openai:v0.21.0@sha256:a230095847e93bd4df9888b33dab956fa9504537b828a23657d2b26fed57b5c9",
  "gpu_min_vram_gb": 24,
  "gpu_count_min": 1,
  "gpu_pool_priority": [
    "NVIDIA A40",
    "NVIDIA GeForce RTX 4090",
    "NVIDIA RTX A6000"
  ],
  "max_concurrency_per_worker": 1,
  "shard_size_hint": 100,
  "per_page_timeout_seconds": 900,
  "prompt_id": "mineru_vlm_no_prompt",
  "prompt_kind": "none",
  "min_cuda_version": "13.0",
  "inference_config": {
    "entrypoint": "mineru.cli.common.do_parse (the function the `mineru` CLI itself calls, invoked in-process so the model singleton stays warm across pages)",
    "backend": "vlm-engine",
    "expected_vlm_engine": "vllm-async-engine",
    "batch_size": 1,
    "lang": "ch",
    "formula_enable": true,
    "table_enable": true,
    "f_dump_md": true,
    "f_dump_middle_json": true,
    "f_dump_model_output": true,
    "f_dump_content_list": true,
    "f_draw_layout_bbox": false,
    "f_draw_span_bbox": false,
    "f_dump_orig_pdf": false,
    "prompt_text_expected": "",
    "concurrency_policy": {
      "per_worker": 1,
      "scale": "replicas_only"
    },
    "env": {
      "MINERU_MODEL_SOURCE": "local",
      "MINERU_TOOLS_CONFIG_JSON": "/opt/arena/mineru.json",
      "MINERU_API_MAX_CONCURRENT_REQUESTS": "1",
      "OMP_NUM_THREADS": "1"
    }
  },
  "weights_strategy": "baked",
  "runtime_mode_allowed": [
    "baked",
    "bootstrap"
  ],
  "official_source_urls": [
    "https://github.com/opendatalab/MinerU",
    "https://github.com/opendatalab/MinerU/releases/tag/mineru-3.4.5-released",
    "https://github.com/opendatalab/MinerU/blob/master/docker/global/Dockerfile",
    "https://huggingface.co/opendatalab/MinerU2.5-Pro-2605-1.2B"
  ],
  "license": {
    "id": "LicenseRef-MinerU-Open-Source-License",
    "url": "https://github.com/opendatalab/MinerU/blob/fbb1257a555a3fde78ae5aaaa931e3b3f8fb2883/LICENSE.md",
    "status": "verified",
    "name": "MinerU Open Source License",
    "spdx_base": "Apache-2.0",
    "additional_terms": true,
    "text_sha256": "sha256:2d9aeb5d15159329a20dd804f251c64860ba954fbd26ec02f802220e6d71cf5c",
    "source_url": "https://raw.githubusercontent.com/opendatalab/MinerU/fbb1257a555a3fde78ae5aaaa931e3b3f8fb2883/LICENSE.md",
    "notes": "Founder decision 2026-09-03 (receipts/registry-updates/license-mineru_vlm.json): status verified, research benchmark execution allowed. LICENSE.md at the pinned runtime_revision is Apache License 2.0 plus additional terms, not bare Apache-2.0: (1) a commercial-licence threshold - a separate commercial licence from the MinerU Team is required once you and your affiliates, on a consolidated basis, exceed 100 million MAU or USD 20 million in total monthly revenue; (2) an online-service attribution obligation - a service built on MinerU must clearly and prominently state that it uses MinerU, in the product/service interface or in public documentation; (3) automatic termination of the licence on breach of either term. text_sha256 above is the sha256 of LICENSE.md fetched read-only from source_url at the pinned revision."
  },
  "weights": {
    "repo": "opendatalab/MinerU2.5-Pro-2605-1.2B",
    "revision": "bff20d4ae2bf202df9f45284b4d43681555a97ed",
    "largest_file": "model.safetensors",
    "largest_file_sha256": "sha256:abf8681ca63b8dec7b67de257af47b821f179442f72998d0696ae2ed9232a5f0"
  },
  "notes": "MASTERPLAN SECTION 14 - THE CAMPAIGN'S MOST IMPORTANT PAST INCIDENT. At worker concurrency 3 this runtime failed 48 of 54 pages with tensor-shape errors, and the set of pages that succeeded changed between repeats, so no accuracy metric could be computed. The rule is absolute: concurrency per worker = 1, throughput scales by horizontal replicas only, never 1 worker x concurrency 8. adapter.py refuses to load with cfg.max_concurrency != 1 rather than clamping it, because a caller who asked for more has a wrong plan and silently correcting it hides the wrong plan. `vlm-engine` is a public backend name that MinerU resolves at call time with get_vlm_engine(inference_engine='auto'), which picks vllm-engine when vLLM is importable and transformers otherwise; the base image does ship vLLM, so the adapter reads the resolved engine and fails closed unless it equals inference_config.expected_vlm_engine. D59 (2026-09-04, after the real canary on pod plz5obsz7ega3a hit the FATAL this preflight is designed to raise): expected_vlm_engine was pinned to 'transformers', which is wrong for this image, not a MinerU bug - mineru/utils/engine_utils.py's _select_linux_engine always returns 'vllm' (formatted 'vllm-engine') when `import vllm` succeeds, and it does on vllm/vllm-openai:v0.21.0; the checkpoint's own official_inference_config (model_registry.json) already names backend 'vllm-engine'; and MinerU's own docker/global/Dockerfile FROMs this same vllm/vllm-openai base image, so auto-detecting vllm-engine on it is the path MinerU's own build documents, not an accident. expected_vlm_engine is now 'vllm-engine' and official_runtime is 'vllm' to match; adapter.py's ModelSingleton (mineru/backend/vlm/vlm_analyze.py) holds the vllm-engine model as an in-process vllm.LLM object, not an HTTP server, so this stays consistent with \"does NOT start a model server\" below. Resolution provenance and every open question live in provenance.json next to this file. D16/D34 (2026-09-03 second integration pass): model_repo / model_revision is the WEIGHTS repository (opendatalab/MinerU2.5-Pro-2605-1.2B @ bff20d4a, re-verified read-only against the Hugging Face revision API on 2026-09-03); runtime_repository / runtime_revision is the RUNTIME CODE repository (opendatalab/MinerU @ fbb1257a, re-verified against the GitHub commits API). prompt_kind is \"none\": the vlm-engine backend takes no prompt and adapter.py refuses a non-empty prompt_text. This runtime does NOT start a model server - MinerU runs in-process through do_parse - so entrypoint.sh keeps `exec` per D19. Framework-floor audit (2026-09-03, after the GLM-OCR canary died on an unrecognised model_type): the required framework floor, what the pinned base image actually ships, the action taken and the evidence URLs are recorded in provenance.json under framework_floor_audit. bootstrap.sh asserts the pinned framework versions and that the framework recognises this checkpoint's architecture before anything starts. D79 (2026-09-04, pod 8uzvgo0oj1vi43): MinerU's two parse paths do not agree on this image. do_parse resolves 'auto' to vllm-engine and returned the layout answer ']]<|><|><|><|>' with an empty body for every page, three canaries running; aio_do_parse resolves to vllm-async-engine and returned correct markdown for the same page in the same process from the adapter's own kwargs. Probes on pod x5kia8xy68w500 had already cleared the kwargs, the env and the calling thread. The vendor's `mineru` command is correct because since 3.4.4 it does not parse in its own process: it starts a LocalAPIServer, and that server is on the async path. adapter.py therefore calls aio_do_parse on an event loop it owns on its own thread (the engine binds to the loop it was created on, so a fresh asyncio.run per page would abandon the cached predictor), and expected_vlm_engine is now 'vllm-async-engine'. This runtime still does NOT start a model server: the async engine is an in-process AsyncLLMEngine, not an HTTP server."
}
